{
  "schema_version": "1.0",
  "id": "d2-dev-0045",
  "messages": [
    {
      "role": "system",
      "content": "You are a helpful assistant with tool access."
    },
    {
      "role": "user",
      "content": "我想了解 RoPE 外推，请先搜索，结果不足再向我澄清需求。"
    },
    {
      "role": "assistant",
      "content": null,
      "tool_calls": [
        {
          "id": "call-d2-dev-0045-0001",
          "type": "function",
          "function": {
            "name": "d1_web_search",
            "arguments": "{\"query\": \"RoPE 外推\", \"limit\": 1}"
          }
        }
      ]
    },
    {
      "role": "tool",
      "content": "关于「RoPE 外推」找到 1 条结果。",
      "tool_call_id": "call-d2-dev-0045-0001",
      "name": "d1_web_search"
    },
    {
      "role": "assistant",
      "content": "这次搜索范围较窄，仅返回 关于「RoPE 外推」找到 1 条结果。；请进一步说明筛选条件。"
    },
    {
      "role": "user",
      "content": "我想了解它在工具调用中的应用。"
    },
    {
      "role": "assistant",
      "content": "了解，我将优先筛选符合该条件的资料。"
    }
  ],
  "tools": [
    {
      "type": "function",
      "function": {
        "name": "d1_web_search",
        "description": "Search the web for information.",
        "parameters": {
          "type": "object",
          "properties": {
            "query": {
              "type": "string"
            },
            "limit": {
              "type": "integer",
              "minimum": 1
            }
          },
          "required": [
            "query"
          ]
        }
      }
    }
  ],
  "expected_tool_calls": [
    {
      "call_id": "call-d2-dev-0045-0001",
      "name": "d1_web_search",
      "arguments": {
        "query": "RoPE 外推",
        "limit": 1
      },
      "expected_result": "关于「RoPE 外推」找到 1 条结果。",
      "depends_on": []
    }
  ],
  "expected_answer": "这次搜索范围较窄，仅返回 关于「RoPE 外推」找到 1 条结果。；请进一步说明筛选条件。",
  "metadata": {
    "source": "d2-synthetic-template",
    "license": "project-internal",
    "task_type": "insufficient_result_search",
    "task_template": "search_then_clarify",
    "data_version": "D2",
    "pipeline_version": "generate_d2_dataset.py/v2.0",
    "created_at": "2026-07-25T17:54:31Z",
    "validation": {
      "schema_valid": true,
      "tool_execution_valid": true,
      "answer_valid": true,
      "quality_passed": true
    },
    "split": "dev",
    "created_at_pos": 45
  }
}