{
  "schema_version": "1.0",
  "id": "d2-train-0122",
  "messages": [
    {
      "role": "system",
      "content": "You are a helpful assistant with tool access."
    },
    {
      "role": "user",
      "content": "请把 'Good morning.' 翻译成中文。"
    },
    {
      "role": "assistant",
      "content": null,
      "tool_calls": [
        {
          "id": "call-d2-train-0122-0001",
          "type": "function",
          "function": {
            "name": "d1_translate",
            "arguments": "{\"text\": \"Good morning.\", \"target_lang\": \"zh\"}"
          }
        }
      ]
    },
    {
      "role": "tool",
      "content": "ERROR: translation service unavailable (text='Good morning.', target_lang='zh')",
      "tool_call_id": "call-d2-train-0122-0001",
      "name": "d1_translate"
    },
    {
      "role": "assistant",
      "content": "翻译工具返回错误：ERROR: translation service unavailable (text='Good morning.', target_lang='zh')。无法完成翻译。"
    }
  ],
  "tools": [
    {
      "type": "function",
      "function": {
        "name": "d1_translate",
        "description": "Translate text to a target language.",
        "parameters": {
          "type": "object",
          "properties": {
            "text": {
              "type": "string"
            },
            "target_lang": {
              "type": "string"
            }
          },
          "required": [
            "text",
            "target_lang"
          ]
        }
      }
    }
  ],
  "expected_tool_calls": [
    {
      "call_id": "call-d2-train-0122-0001",
      "name": "d1_translate",
      "arguments": {
        "text": "Good morning.",
        "target_lang": "zh"
      },
      "expected_result": "ERROR: translation service unavailable (text='Good morning.', target_lang='zh')",
      "depends_on": []
    }
  ],
  "expected_answer": "翻译工具返回错误：ERROR: translation service unavailable (text='Good morning.', target_lang='zh')。无法完成翻译。",
  "metadata": {
    "source": "d2-synthetic-template",
    "license": "project-internal",
    "task_type": "tool_error_response",
    "task_template": "translate_error_report",
    "data_version": "D2",
    "pipeline_version": "generate_d2_dataset.py/v2.0",
    "created_at": "2026-08-27T00:02:02+00:00",
    "validation": {
      "schema_valid": true,
      "tool_execution_valid": true,
      "answer_valid": true,
      "quality_passed": true
    },
    "split": "train"
  }
}