{
  "schema_version": "1.0",
  "id": "d2-dev-0079",
  "messages": [
    {
      "role": "system",
      "content": "You are a helpful assistant with tool access."
    },
    {
      "role": "user",
      "content": "搜索 Mamba 的 序列模型近期进展；结果不足时请调整查询。"
    },
    {
      "role": "assistant",
      "content": null,
      "tool_calls": [
        {
          "id": "call-d2-dev-0079-0001",
          "type": "function",
          "function": {
            "name": "d1_web_search",
            "arguments": "{\"query\": \"Mamba\", \"limit\": 1}"
          }
        }
      ]
    },
    {
      "role": "tool",
      "content": "关于「Mamba」找到 1 条结果。",
      "tool_call_id": "call-d2-dev-0079-0001",
      "name": "d1_web_search"
    },
    {
      "role": "assistant",
      "content": "这个搜索范围太宽，我先调整检索词。"
    },
    {
      "role": "assistant",
      "content": null,
      "tool_calls": [
        {
          "id": "call-d2-dev-0079-0002",
          "type": "function",
          "function": {
            "name": "d1_web_search",
            "arguments": "{\"query\": \"Mamba 状态空间模型 2025\", \"limit\": 4}"
          }
        }
      ]
    },
    {
      "role": "tool",
      "content": "关于「Mamba 状态空间模型 2025」找到 4 条结果。",
      "tool_call_id": "call-d2-dev-0079-0002",
      "name": "d1_web_search"
    },
    {
      "role": "assistant",
      "content": "初次搜索『Mamba』结果过少（序列模型近期进展），已重试为『Mamba 状态空间模型 2025』并扩大 limit，得到：关于「Mamba 状态空间模型 2025」找到 4 条结果。"
    }
  ],
  "tools": [
    {
      "type": "function",
      "function": {
        "name": "d1_web_search",
        "description": "Search the web for information.",
        "parameters": {
          "type": "object",
          "properties": {
            "query": {
              "type": "string"
            },
            "limit": {
              "type": "integer",
              "minimum": 1
            }
          },
          "required": [
            "query"
          ]
        }
      }
    }
  ],
  "expected_tool_calls": [
    {
      "call_id": "call-d2-dev-0079-0001",
      "name": "d1_web_search",
      "arguments": {
        "query": "Mamba",
        "limit": 1
      },
      "expected_result": "关于「Mamba」找到 1 条结果。",
      "depends_on": []
    },
    {
      "call_id": "call-d2-dev-0079-0002",
      "name": "d1_web_search",
      "arguments": {
        "query": "Mamba 状态空间模型 2025",
        "limit": 4
      },
      "depends_on": [
        "call-d2-dev-0079-0001"
      ],
      "expected_result": "关于「Mamba 状态空间模型 2025」找到 4 条结果。"
    }
  ],
  "expected_answer": "初次搜索『Mamba』结果过少（序列模型近期进展），已重试为『Mamba 状态空间模型 2025』并扩大 limit，得到：关于「Mamba 状态空间模型 2025」找到 4 条结果。",
  "metadata": {
    "source": "d2-synthetic-template",
    "license": "project-internal",
    "task_type": "error_recovery",
    "task_template": "refine_query_after_insufficient_result",
    "data_version": "D2",
    "pipeline_version": "generate_d2_dataset.py/v2.0",
    "created_at": "2026-07-25T17:55:05Z",
    "validation": {
      "schema_valid": true,
      "tool_execution_valid": true,
      "answer_valid": true,
      "quality_passed": true
    },
    "split": "dev",
    "created_at_pos": 79
  }
}