{
  "schema_version": "1.0",
  "id": "d2-test-0077",
  "messages": [
    {
      "role": "system",
      "content": "You are a helpful assistant with tool access."
    },
    {
      "role": "user",
      "content": "搜索 BPE 的 分词训练方法；结果不足时请调整查询。"
    },
    {
      "role": "assistant",
      "content": null,
      "tool_calls": [
        {
          "id": "call-d2-test-0077-0001",
          "type": "function",
          "function": {
            "name": "d1_web_search",
            "arguments": "{\"query\": \"BPE\", \"limit\": 1}"
          }
        }
      ]
    },
    {
      "role": "tool",
      "content": "关于「BPE」找到 1 条结果。",
      "tool_call_id": "call-d2-test-0077-0001",
      "name": "d1_web_search"
    },
    {
      "role": "assistant",
      "content": "“BPE”结果过少，我会细化关键词后重试。"
    },
    {
      "role": "assistant",
      "content": null,
      "tool_calls": [
        {
          "id": "call-d2-test-0077-0002",
          "type": "function",
          "function": {
            "name": "d1_web_search",
            "arguments": "{\"query\": \"BPE 词表训练 2025\", \"limit\": 3}"
          }
        }
      ]
    },
    {
      "role": "tool",
      "content": "关于「BPE 词表训练 2025」找到 3 条结果。",
      "tool_call_id": "call-d2-test-0077-0002",
      "name": "d1_web_search"
    },
    {
      "role": "assistant",
      "content": "『BPE』的初步结果不够，我将分词训练方法聚焦到『BPE 词表训练 2025』，返回：关于「BPE 词表训练 2025」找到 3 条结果。"
    }
  ],
  "tools": [
    {
      "type": "function",
      "function": {
        "name": "d1_web_search",
        "description": "Search the web for information.",
        "parameters": {
          "type": "object",
          "properties": {
            "query": {
              "type": "string"
            },
            "limit": {
              "type": "integer",
              "minimum": 1
            }
          },
          "required": [
            "query"
          ]
        }
      }
    }
  ],
  "expected_tool_calls": [
    {
      "call_id": "call-d2-test-0077-0001",
      "name": "d1_web_search",
      "arguments": {
        "query": "BPE",
        "limit": 1
      },
      "expected_result": "关于「BPE」找到 1 条结果。",
      "depends_on": []
    },
    {
      "call_id": "call-d2-test-0077-0002",
      "name": "d1_web_search",
      "arguments": {
        "query": "BPE 词表训练 2025",
        "limit": 3
      },
      "depends_on": [
        "call-d2-test-0077-0001"
      ],
      "expected_result": "关于「BPE 词表训练 2025」找到 3 条结果。"
    }
  ],
  "expected_answer": "『BPE』的初步结果不够，我将分词训练方法聚焦到『BPE 词表训练 2025』，返回：关于「BPE 词表训练 2025」找到 3 条结果。",
  "metadata": {
    "source": "d2-synthetic-template",
    "license": "project-internal",
    "task_type": "error_recovery",
    "task_template": "refine_query_after_insufficient_result",
    "data_version": "D2",
    "pipeline_version": "generate_d2_dataset.py/v2.0",
    "created_at": "2026-07-25T17:55:03Z",
    "validation": {
      "schema_valid": true,
      "tool_execution_valid": true,
      "answer_valid": true,
      "quality_passed": true
    },
    "split": "test",
    "created_at_pos": 77
  }
}