{
  "schema_version": "1.0",
  "id": "d2-dev-076",
  "messages": [
    {
      "role": "system",
      "content": "You are a helpful assistant with tool access."
    },
    {
      "role": "user",
      "content": "帮我查一下上海的天气。"
    },
    {
      "role": "assistant",
      "content": null,
      "tool_calls": [
        {
          "id": "call-d2-dev-076-0001",
          "type": "function",
          "function": {
            "name": "d1_get_weather",
            "arguments": "{\"city\": \"上海\"}"
          }
        }
      ]
    },
    {
      "role": "tool",
      "content": "上海 当前天气：晴，22°C，微风。",
      "tool_call_id": "call-d2-dev-076-0001",
      "name": "d1_get_weather"
    },
    {
      "role": "user",
      "content": "改成查北京的天气吧。"
    },
    {
      "role": "assistant",
      "content": null,
      "tool_calls": [
        {
          "id": "call-d2-dev-076-0002",
          "type": "function",
          "function": {
            "name": "d1_get_weather",
            "arguments": "{\"city\": \"北京\"}"
          }
        }
      ]
    },
    {
      "role": "tool",
      "content": "北京 当前天气：晴，22°C，微风。",
      "tool_call_id": "call-d2-dev-076-0002",
      "name": "d1_get_weather"
    },
    {
      "role": "assistant",
      "content": "按最新要求，北京天气：北京 当前天气：晴，22°C，微风。"
    }
  ],
  "tools": [
    {
      "type": "function",
      "function": {
        "name": "d1_get_weather",
        "description": "Look up the current weather for a city.",
        "parameters": {
          "type": "object",
          "properties": {
            "city": {
              "type": "string"
            }
          },
          "required": [
            "city"
          ]
        }
      }
    }
  ],
  "expected_tool_calls": [
    {
      "call_id": "call-d2-dev-076-0001",
      "name": "d1_get_weather",
      "arguments": {
        "city": "上海"
      },
      "expected_result": "上海 当前天气：晴，22°C，微风。",
      "depends_on": []
    },
    {
      "call_id": "call-d2-dev-076-0002",
      "name": "d1_get_weather",
      "arguments": {
        "city": "北京"
      },
      "depends_on": [
        "call-d2-dev-076-0001"
      ],
      "expected_result": "北京 当前天气：晴，22°C，微风。"
    }
  ],
  "expected_answer": "按最新要求，北京天气：北京 当前天气：晴，22°C，微风。",
  "metadata": {
    "source": "d2-synthetic-template",
    "license": "project-internal",
    "task_type": "req_change_city",
    "task_template": "abandoned_old_city_then_retry",
    "data_version": "D2",
    "pipeline_version": "generate_d2_dataset.py/v2.0",
    "created_at": "2026-07-25T18:02:02Z",
    "validation": {
      "schema_valid": true,
      "tool_execution_valid": true,
      "answer_valid": true,
      "quality_passed": true
    },
    "split": "dev"
  }
}