{
  "schema_version": "1.0",
  "id": "d2-train-0288",
  "messages": [
    {
      "role": "system",
      "content": "You are a helpful assistant with tool access."
    },
    {
      "role": "user",
      "content": "请按顺序处理 2 ** 6 和后续搜索，搜索关键词使用 所得数值 64。"
    },
    {
      "role": "assistant",
      "content": null,
      "tool_calls": [
        {
          "id": "call-d2-train-0288-0001",
          "type": "function",
          "function": {
            "name": "d1_calculate",
            "arguments": "{\"expression\": \"2 ** 6\"}"
          }
        }
      ]
    },
    {
      "role": "tool",
      "content": "64",
      "tool_call_id": "call-d2-train-0288-0001",
      "name": "d1_calculate"
    },
    {
      "role": "assistant",
      "content": null,
      "tool_calls": [
        {
          "id": "call-d2-train-0288-0002",
          "type": "function",
          "function": {
            "name": "d1_web_search",
            "arguments": "{\"query\": \"所得数值 64\", \"limit\": 2}"
          }
        }
      ]
    },
    {
      "role": "tool",
      "content": "关于「所得数值 64」找到 2 条结果。",
      "tool_call_id": "call-d2-train-0288-0002",
      "name": "d1_web_search"
    },
    {
      "role": "assistant",
      "content": "第一步结果为 64；随后搜索得到：关于「所得数值 64」找到 2 条结果。"
    }
  ],
  "tools": [
    {
      "type": "function",
      "function": {
        "name": "d1_calculate",
        "description": "Evaluate a simple arithmetic expression on integers.",
        "parameters": {
          "type": "object",
          "properties": {
            "expression": {
              "type": "string"
            }
          },
          "required": [
            "expression"
          ]
        }
      }
    },
    {
      "type": "function",
      "function": {
        "name": "d1_web_search",
        "description": "Search the web for information.",
        "parameters": {
          "type": "object",
          "properties": {
            "query": {
              "type": "string"
            },
            "limit": {
              "type": "integer",
              "minimum": 1
            }
          },
          "required": [
            "query"
          ]
        }
      }
    }
  ],
  "expected_tool_calls": [
    {
      "call_id": "call-d2-train-0288-0001",
      "name": "d1_calculate",
      "arguments": {
        "expression": "2 ** 6"
      },
      "expected_result": 64,
      "depends_on": []
    },
    {
      "call_id": "call-d2-train-0288-0002",
      "name": "d1_web_search",
      "arguments": {
        "query": "所得数值 64",
        "limit": 2
      },
      "depends_on": [
        "call-d2-train-0288-0001"
      ],
      "expected_result": "关于「所得数值 64」找到 2 条结果。"
    }
  ],
  "expected_answer": "第一步结果为 64；随后搜索得到：关于「所得数值 64」找到 2 条结果。",
  "metadata": {
    "source": "d2-synthetic-template",
    "license": "project-internal",
    "task_type": "multi_tool_sequential",
    "task_template": "calc_then_search",
    "data_version": "D2",
    "pipeline_version": "generate_d2_dataset.py/v2.0",
    "created_at": "2026-07-25T17:58:34Z",
    "validation": {
      "schema_valid": true,
      "tool_execution_valid": true,
      "answer_valid": true,
      "quality_passed": true
    },
    "split": "train",
    "created_at_pos": 288
  }
}