{
  "schema_version": "1.0",
  "id": "d2-train-0294",
  "messages": [
    {
      "role": "system",
      "content": "You are a helpful assistant with tool access."
    },
    {
      "role": "user",
      "content": "搜索 scaling laws 的 扩展律研究；结果不足时请调整查询。（场景是安全审查，额外要求是记录关键中间结果。）"
    },
    {
      "role": "assistant",
      "content": null,
      "tool_calls": [
        {
          "id": "call-d2-train-0294-0001",
          "type": "function",
          "function": {
            "name": "d1_web_search",
            "arguments": "{\"query\": \"scaling laws\", \"limit\": 2}"
          }
        }
      ]
    },
    {
      "role": "tool",
      "content": "关于「scaling laws」找到 2 条结果。",
      "tool_call_id": "call-d2-train-0294-0001",
      "name": "d1_web_search"
    },
    {
      "role": "assistant",
      "content": "初次检索不充分，接下来我会收窄到更具体的关键词。"
    },
    {
      "role": "assistant",
      "content": null,
      "tool_calls": [
        {
          "id": "call-d2-train-0294-0002",
          "type": "function",
          "function": {
            "name": "d1_web_search",
            "arguments": "{\"query\": \"Chinchilla scaling law 修正\", \"limit\": 3}"
          }
        }
      ]
    },
    {
      "role": "tool",
      "content": "关于「Chinchilla scaling law 修正」找到 3 条结果。",
      "tool_call_id": "call-d2-train-0294-0002",
      "name": "d1_web_search"
    },
    {
      "role": "assistant",
      "content": "搜索『scaling laws』后发现信息不足，我按扩展律研究调整到『Chinchilla scaling law 修正』：关于「Chinchilla scaling law 修正」找到 3 条结果。（场景是安全审查，额外要求是记录关键中间结果。）"
    }
  ],
  "tools": [
    {
      "type": "function",
      "function": {
        "name": "d1_web_search",
        "description": "Search the web for information.",
        "parameters": {
          "type": "object",
          "properties": {
            "query": {
              "type": "string"
            },
            "limit": {
              "type": "integer",
              "minimum": 1
            }
          },
          "required": [
            "query"
          ]
        }
      }
    }
  ],
  "expected_tool_calls": [
    {
      "call_id": "call-d2-train-0294-0001",
      "name": "d1_web_search",
      "arguments": {
        "query": "scaling laws",
        "limit": 2
      },
      "expected_result": "关于「scaling laws」找到 2 条结果。",
      "depends_on": []
    },
    {
      "call_id": "call-d2-train-0294-0002",
      "name": "d1_web_search",
      "arguments": {
        "query": "Chinchilla scaling law 修正",
        "limit": 3
      },
      "depends_on": [
        "call-d2-train-0294-0001"
      ],
      "expected_result": "关于「Chinchilla scaling law 修正」找到 3 条结果。"
    }
  ],
  "expected_answer": "搜索『scaling laws』后发现信息不足，我按扩展律研究调整到『Chinchilla scaling law 修正』：关于「Chinchilla scaling law 修正」找到 3 条结果。（场景是安全审查，额外要求是记录关键中间结果。）",
  "metadata": {
    "source": "d2-synthetic-template",
    "license": "project-internal",
    "task_type": "error_recovery",
    "task_template": "refine_query_after_insufficient_result",
    "data_version": "D2",
    "pipeline_version": "generate_d2_dataset.py/v2.0",
    "created_at": "2026-07-25T17:58:40Z",
    "validation": {
      "schema_valid": true,
      "tool_execution_valid": true,
      "answer_valid": true,
      "quality_passed": true
    },
    "split": "train"
  }
}