{
  "schema_version": "1.0",
  "id": "d2-train-0161",
  "messages": [
    {
      "role": "system",
      "content": "You are a helpful assistant with tool access."
    },
    {
      "role": "user",
      "content": "帮我搜集 量化推理 相关内容，若只有少量结果就先询问我的关注点。"
    },
    {
      "role": "assistant",
      "content": null,
      "tool_calls": [
        {
          "id": "call-d2-train-0161-0001",
          "type": "function",
          "function": {
            "name": "d1_web_search",
            "arguments": "{\"query\": \"量化推理\", \"limit\": 1}"
          }
        }
      ]
    },
    {
      "role": "tool",
      "content": "关于「量化推理」找到 1 条结果。",
      "tool_call_id": "call-d2-train-0161-0001",
      "name": "d1_web_search"
    },
    {
      "role": "assistant",
      "content": "仅找到 1 条结果：关于「量化推理」找到 1 条结果。。请补充你关注的方向。"
    },
    {
      "role": "user",
      "content": "我想了解它在工具调用中的应用。"
    },
    {
      "role": "assistant",
      "content": "收到，我会按这个方向继续。"
    }
  ],
  "tools": [
    {
      "type": "function",
      "function": {
        "name": "d1_web_search",
        "description": "Search the web for information.",
        "parameters": {
          "type": "object",
          "properties": {
            "query": {
              "type": "string"
            },
            "limit": {
              "type": "integer",
              "minimum": 1
            }
          },
          "required": [
            "query"
          ]
        }
      }
    }
  ],
  "expected_tool_calls": [
    {
      "call_id": "call-d2-train-0161-0001",
      "name": "d1_web_search",
      "arguments": {
        "query": "量化推理",
        "limit": 1
      },
      "expected_result": "关于「量化推理」找到 1 条结果。",
      "depends_on": []
    }
  ],
  "expected_answer": "仅找到 1 条结果：关于「量化推理」找到 1 条结果。。请补充你关注的方向。",
  "metadata": {
    "source": "d2-synthetic-template",
    "license": "project-internal",
    "task_type": "insufficient_result_search",
    "task_template": "search_then_clarify",
    "data_version": "D2",
    "pipeline_version": "generate_d2_dataset.py/v2.0",
    "created_at": "2026-07-25T17:56:27Z",
    "validation": {
      "schema_valid": true,
      "tool_execution_valid": true,
      "answer_valid": true,
      "quality_passed": true
    },
    "split": "train",
    "created_at_pos": 161
  }
}