{
  "schema_version": "1.0",
  "id": "d2-train-0126",
  "messages": [
    {
      "role": "system",
      "content": "You are a helpful assistant with tool access."
    },
    {
      "role": "user",
      "content": "搜索 PyTorch 的最新特性；结果不足时请调整查询。"
    },
    {
      "role": "assistant",
      "content": null,
      "tool_calls": [
        {
          "id": "call-d2-train-0126-0001",
          "type": "function",
          "function": {
            "name": "d1_web_search",
            "arguments": "{\"query\": \"PyTorch\", \"limit\": 1}"
          }
        }
      ]
    },
    {
      "role": "tool",
      "content": "关于「PyTorch」找到 1 条结果。",
      "tool_call_id": "call-d2-train-0126-0001",
      "name": "d1_web_search"
    },
    {
      "role": "assistant",
      "content": "结果过少，我会细化关键词后重试。"
    },
    {
      "role": "assistant",
      "content": null,
      "tool_calls": [
        {
          "id": "call-d2-train-0126-0002",
          "type": "function",
          "function": {
            "name": "d1_web_search",
            "arguments": "{\"query\": \"PyTorch 2.x 新特性\", \"limit\": 3}"
          }
        }
      ]
    },
    {
      "role": "tool",
      "content": "关于「PyTorch 2.x 新特性」找到 3 条结果。",
      "tool_call_id": "call-d2-train-0126-0002",
      "name": "d1_web_search"
    },
    {
      "role": "assistant",
      "content": "初始搜索过窄，已重试细化关键词：关于「PyTorch 2.x 新特性」找到 3 条结果。"
    }
  ],
  "tools": [
    {
      "type": "function",
      "function": {
        "name": "d1_web_search",
        "description": "Search the web for information.",
        "parameters": {
          "type": "object",
          "properties": {
            "query": {
              "type": "string"
            },
            "limit": {
              "type": "integer",
              "minimum": 1
            }
          },
          "required": [
            "query"
          ]
        }
      }
    }
  ],
  "expected_tool_calls": [
    {
      "call_id": "call-d2-train-0126-0001",
      "name": "d1_web_search",
      "arguments": {
        "query": "PyTorch",
        "limit": 1
      },
      "expected_result": "关于「PyTorch」找到 1 条结果。",
      "depends_on": []
    },
    {
      "call_id": "call-d2-train-0126-0002",
      "name": "d1_web_search",
      "arguments": {
        "query": "PyTorch 2.x 新特性",
        "limit": 3
      },
      "depends_on": [
        "call-d2-train-0126-0001"
      ],
      "expected_result": "关于「PyTorch 2.x 新特性」找到 3 条结果。"
    }
  ],
  "expected_answer": "初始搜索过窄，已重试细化关键词：关于「PyTorch 2.x 新特性」找到 3 条结果。",
  "metadata": {
    "source": "d2-synthetic-template",
    "license": "project-internal",
    "task_type": "error_recovery",
    "task_template": "refine_query_after_insufficient_result",
    "data_version": "D2",
    "pipeline_version": "generate_d2_dataset.py/v2.0",
    "created_at": "2026-08-27T00:02:06+00:00",
    "validation": {
      "schema_valid": true,
      "tool_execution_valid": true,
      "answer_valid": true,
      "quality_passed": true
    },
    "split": "train"
  }
}