{
  "schema_version": "1.0",
  "id": "d2-train-0239",
  "messages": [
    {
      "role": "system",
      "content": "You are a helpful assistant with tool access."
    },
    {
      "role": "user",
      "content": "请先看看广州今天的天气情况。"
    },
    {
      "role": "assistant",
      "content": null,
      "tool_calls": [
        {
          "id": "call-d2-train-0239-0001",
          "type": "function",
          "function": {
            "name": "d1_get_weather",
            "arguments": "{\"city\": \"广州\"}"
          }
        }
      ]
    },
    {
      "role": "tool",
      "content": "广州 当前天气：晴，22°C，微风。",
      "tool_call_id": "call-d2-train-0239-0001",
      "name": "d1_get_weather"
    },
    {
      "role": "user",
      "content": "现在优先给我南京的天气。"
    },
    {
      "role": "assistant",
      "content": null,
      "tool_calls": [
        {
          "id": "call-d2-train-0239-0002",
          "type": "function",
          "function": {
            "name": "d1_get_weather",
            "arguments": "{\"city\": \"南京\"}"
          }
        }
      ]
    },
    {
      "role": "tool",
      "content": "南京 当前天气：晴，22°C，微风。",
      "tool_call_id": "call-d2-train-0239-0002",
      "name": "d1_get_weather"
    },
    {
      "role": "assistant",
      "content": "按最新要求，南京天气：南京 当前天气：晴，22°C，微风。"
    }
  ],
  "tools": [
    {
      "type": "function",
      "function": {
        "name": "d1_get_weather",
        "description": "Look up the current weather for a city.",
        "parameters": {
          "type": "object",
          "properties": {
            "city": {
              "type": "string"
            }
          },
          "required": [
            "city"
          ]
        }
      }
    }
  ],
  "expected_tool_calls": [
    {
      "call_id": "call-d2-train-0239-0001",
      "name": "d1_get_weather",
      "arguments": {
        "city": "广州"
      },
      "expected_result": "广州 当前天气：晴，22°C，微风。",
      "depends_on": []
    },
    {
      "call_id": "call-d2-train-0239-0002",
      "name": "d1_get_weather",
      "arguments": {
        "city": "南京"
      },
      "depends_on": [
        "call-d2-train-0239-0001"
      ],
      "expected_result": "南京 当前天气：晴，22°C，微风。"
    }
  ],
  "expected_answer": "按最新要求，南京天气：南京 当前天气：晴，22°C，微风。",
  "metadata": {
    "source": "d2-synthetic-template",
    "license": "project-internal",
    "task_type": "req_change_city",
    "task_template": "abandoned_old_city_then_retry",
    "data_version": "D2",
    "pipeline_version": "generate_d2_dataset.py/v2.0",
    "created_at": "2026-07-25T17:57:45Z",
    "validation": {
      "schema_valid": true,
      "tool_execution_valid": true,
      "answer_valid": true,
      "quality_passed": true
    },
    "split": "train",
    "created_at_pos": 239
  }
}