{
  "schema_version": "1.0",
  "id": "d2-train-0325",
  "messages": [
    {
      "role": "system",
      "content": "You are a helpful assistant with tool access."
    },
    {
      "role": "user",
      "content": "请处理下面这项请求：帮我看看公司楼下有没有停车位。 我今天就要用到结果。（场景是成本控制，额外要求是避免臆造无法验证的信息。）"
    },
    {
      "role": "assistant",
      "content": "可用工具无法支持停车位查询；本次请求不能由工具链完成。（场景是成本控制，额外要求是避免臆造无法验证的信息。）"
    }
  ],
  "tools": [
    {
      "type": "function",
      "function": {
        "name": "d1_calculate",
        "description": "Evaluate a simple arithmetic expression on integers.",
        "parameters": {
          "type": "object",
          "properties": {
            "expression": {
              "type": "string"
            }
          },
          "required": [
            "expression"
          ]
        }
      }
    },
    {
      "type": "function",
      "function": {
        "name": "d1_get_weather",
        "description": "Look up the current weather for a city.",
        "parameters": {
          "type": "object",
          "properties": {
            "city": {
              "type": "string"
            }
          },
          "required": [
            "city"
          ]
        }
      }
    },
    {
      "type": "function",
      "function": {
        "name": "d1_web_search",
        "description": "Search the web for information.",
        "parameters": {
          "type": "object",
          "properties": {
            "query": {
              "type": "string"
            },
            "limit": {
              "type": "integer",
              "minimum": 1
            }
          },
          "required": [
            "query"
          ]
        }
      }
    }
  ],
  "expected_tool_calls": [],
  "expected_answer": "可用工具无法支持停车位查询；本次请求不能由工具链完成。（场景是成本控制，额外要求是避免臆造无法验证的信息。）",
  "metadata": {
    "source": "d2-synthetic-template",
    "license": "project-internal",
    "task_type": "tool_not_available",
    "task_template": "missing_停车位查询",
    "data_version": "D2",
    "pipeline_version": "generate_d2_dataset.py/v2.0",
    "created_at": "2026-07-25T17:59:11Z",
    "validation": {
      "schema_valid": true,
      "tool_execution_valid": true,
      "answer_valid": true,
      "quality_passed": true
    },
    "split": "train"
  }
}