{
  "schema_version": "1.0",
  "id": "d2-dev-0058",
  "messages": [
    {
      "role": "system",
      "content": "You are a helpful assistant with tool access."
    },
    {
      "role": "user",
      "content": "请调用天气工具查询西安。"
    },
    {
      "role": "assistant",
      "content": null,
      "tool_calls": [
        {
          "id": "call-d2-dev-0058-0001",
          "type": "function",
          "function": {
            "name": "d1_get_weather",
            "arguments": "{\"city\": \"西安\"}"
          }
        }
      ]
    },
    {
      "role": "tool",
      "content": "西安 当前天气：晴，22°C，微风。",
      "tool_call_id": "call-d2-dev-0058-0001",
      "name": "d1_get_weather"
    },
    {
      "role": "user",
      "content": "我改变主意了，改看昆明的天气。"
    },
    {
      "role": "assistant",
      "content": null,
      "tool_calls": [
        {
          "id": "call-d2-dev-0058-0002",
          "type": "function",
          "function": {
            "name": "d1_get_weather",
            "arguments": "{\"city\": \"昆明\"}"
          }
        }
      ]
    },
    {
      "role": "tool",
      "content": "昆明 当前天气：晴，22°C，微风。",
      "tool_call_id": "call-d2-dev-0058-0002",
      "name": "d1_get_weather"
    },
    {
      "role": "assistant",
      "content": "忽略之前的西安，当前结果是昆明 当前天气：晴，22°C，微风。"
    }
  ],
  "tools": [
    {
      "type": "function",
      "function": {
        "name": "d1_get_weather",
        "description": "Look up the current weather for a city.",
        "parameters": {
          "type": "object",
          "properties": {
            "city": {
              "type": "string"
            }
          },
          "required": [
            "city"
          ]
        }
      }
    }
  ],
  "expected_tool_calls": [
    {
      "call_id": "call-d2-dev-0058-0001",
      "name": "d1_get_weather",
      "arguments": {
        "city": "西安"
      },
      "expected_result": "西安 当前天气：晴，22°C，微风。",
      "depends_on": []
    },
    {
      "call_id": "call-d2-dev-0058-0002",
      "name": "d1_get_weather",
      "arguments": {
        "city": "昆明"
      },
      "depends_on": [
        "call-d2-dev-0058-0001"
      ],
      "expected_result": "昆明 当前天气：晴，22°C，微风。"
    }
  ],
  "expected_answer": "忽略之前的西安，当前结果是昆明 当前天气：晴，22°C，微风。",
  "metadata": {
    "source": "d2-synthetic-template",
    "license": "project-internal",
    "task_type": "req_change_city",
    "task_template": "abandoned_old_city_then_retry",
    "data_version": "D2",
    "pipeline_version": "generate_d2_dataset.py/v2.0",
    "created_at": "2026-07-25T17:54:44Z",
    "validation": {
      "schema_valid": true,
      "tool_execution_valid": true,
      "answer_valid": true,
      "quality_passed": true
    },
    "split": "dev",
    "created_at_pos": 58
  }
}