{
  "schema_version": "1.0",
  "id": "d2-test-0022",
  "messages": [
    {
      "role": "system",
      "content": "You are a helpful assistant with tool access."
    },
    {
      "role": "user",
      "content": "我需要日文版本，请翻译：Deploy after validation."
    },
    {
      "role": "assistant",
      "content": null,
      "tool_calls": [
        {
          "id": "call-d2-test-0022-0001",
          "type": "function",
          "function": {
            "name": "d1_translate",
            "arguments": "{\"text\": \"Deploy after validation.\", \"target_lang\": \"ja\"}"
          }
        }
      ]
    },
    {
      "role": "tool",
      "content": "ERROR: translation service unavailable (text='Deploy after validation.', target_lang='ja')",
      "tool_call_id": "call-d2-test-0022-0001",
      "name": "d1_translate"
    },
    {
      "role": "assistant",
      "content": "已调用翻译工具，但它报告错误：ERROR: translation service unavailable (text='Deploy after validation.', target_lang='ja')。请稍后重试。"
    }
  ],
  "tools": [
    {
      "type": "function",
      "function": {
        "name": "d1_translate",
        "description": "Translate text to a target language.",
        "parameters": {
          "type": "object",
          "properties": {
            "text": {
              "type": "string"
            },
            "target_lang": {
              "type": "string"
            }
          },
          "required": [
            "text",
            "target_lang"
          ]
        }
      }
    }
  ],
  "expected_tool_calls": [
    {
      "call_id": "call-d2-test-0022-0001",
      "name": "d1_translate",
      "arguments": {
        "text": "Deploy after validation.",
        "target_lang": "ja"
      },
      "expected_result": "ERROR: translation service unavailable (text='Deploy after validation.', target_lang='ja')",
      "depends_on": []
    }
  ],
  "expected_answer": "已调用翻译工具，但它报告错误：ERROR: translation service unavailable (text='Deploy after validation.', target_lang='ja')。请稍后重试。",
  "metadata": {
    "source": "d2-synthetic-template",
    "license": "project-internal",
    "task_type": "tool_error_response",
    "task_template": "translate_error_report",
    "data_version": "D2",
    "pipeline_version": "generate_d2_dataset.py/v2.0",
    "created_at": "2026-07-25T17:54:08Z",
    "validation": {
      "schema_valid": true,
      "tool_execution_valid": true,
      "answer_valid": true,
      "quality_passed": true
    },
    "split": "test",
    "created_at_pos": 22
  }
}